[
  {
    "id": "awb_2460f21e330da51e121c",
    "name": "Radio BLAU Leipzig (trocken 320kbps)",
    "country": "NE",
    "subdivision": "Suisse Romande",
    "languages": [],
    "categories": [],
    "tags": [
      "amateurfunk",
      "bürgerradio"
    ],
    "homepage": "http://dasha.at/cxdashboard.html",
    "favicon": null,
    "type": null,
    "sourceCount": 1,
    "updatedAt": "2026-01-14T22:54:11Z"
  },
  {
    "id": "awb_fc7ad61fa2494328cb1b",
    "name": "Wadata Radio 107.4 Niamey",
    "country": "NE",
    "subdivision": null,
    "languages": [
      "fr"
    ],
    "categories": [],
    "tags": [
      "african music"
    ],
    "homepage": "https://wadataradio.com/",
    "favicon": null,
    "type": null,
    "sourceCount": 1,
    "updatedAt": "2026-01-15T03:23:20Z"
  }
]
