[
  {
    "id": "awb_2c64ae770dedad260fd3",
    "name": "Radio Maria Lesotho",
    "country": "LS",
    "subdivision": null,
    "languages": [],
    "categories": [],
    "tags": [],
    "homepage": "https://dreamsiteradioplayer.it/wf/wflesotho/",
    "favicon": "https://dreamsiteradioplayer.it/wf/wflesotho/tmp/images/default.jpg",
    "type": null,
    "sourceCount": 1,
    "updatedAt": "2026-01-14T22:54:04Z"
  }
]
