[
  {
    "id": "awb_5a19447bdf4242b57e34",
    "name": "Abdulbasit Abdulsamad",
    "country": "NC",
    "subdivision": null,
    "languages": [
      "ar"
    ],
    "categories": [],
    "tags": [],
    "homepage": "https://mp3islam.com/",
    "favicon": null,
    "type": null,
    "sourceCount": 1,
    "updatedAt": "2026-08-23"
  },
  {
    "id": "awb_d875f4296f937604475b",
    "name": "NIA Lo-Fi",
    "country": "NC",
    "subdivision": null,
    "languages": [],
    "categories": [],
    "tags": [],
    "homepage": "https://nia.nc/",
    "favicon": "https://nia.nc/static/icons/apple-touch-icon.png",
    "type": null,
    "sourceCount": 1,
    "updatedAt": "2026-01-14T22:54:12Z"
  },
  {
    "id": "awb_60dfde3449ffa4ebadc8",
    "name": "NIA Pacifique",
    "country": "NC",
    "subdivision": null,
    "languages": [],
    "categories": [],
    "tags": [],
    "homepage": "https://nia.nc/",
    "favicon": "https://nia.nc/static/icons/apple-touch-icon.png",
    "type": null,
    "sourceCount": 1,
    "updatedAt": "2026-01-14T22:54:12Z"
  },
  {
    "id": "awb_d4065ebfdc04df5afae9",
    "name": "NIA Radio - Pacifique",
    "country": "NC",
    "subdivision": null,
    "languages": [],
    "categories": [
      "electronic"
    ],
    "tags": [
      "electronica",
      "house",
      "techno"
    ],
    "homepage": "https://nia.nc/",
    "favicon": "https://nia.nc/static/icons/apple-touch-icon.png",
    "type": null,
    "sourceCount": 2,
    "updatedAt": "2026-08-23"
  },
  {
    "id": "awb_d63b9b8b6c1e2eb444cf",
    "name": "NIA Radio Lo-Fi",
    "country": "NC",
    "subdivision": null,
    "languages": [
      "fr"
    ],
    "categories": [
      "ambient",
      "hip-hop"
    ],
    "tags": [
      "chillout",
      "lofi",
      "lofi hip hop"
    ],
    "homepage": "https://nia.nc/",
    "favicon": null,
    "type": null,
    "sourceCount": 2,
    "updatedAt": "2026-08-23"
  },
  {
    "id": "awb_8aead06a1c74f84de92b",
    "name": "Nouvelle-Calédonie La Première",
    "country": "NC",
    "subdivision": "Nouméa",
    "languages": [
      "fr"
    ],
    "categories": [
      "talk"
    ],
    "tags": [
      "music",
      "talk"
    ],
    "homepage": "http://nouvellecaledonie.la1ere.fr/radio/",
    "favicon": null,
    "type": null,
    "sourceCount": 2,
    "updatedAt": "2026-08-23"
  },
  {
    "id": "awb_bfe68f78cdfa3c4823ab",
    "name": "Radio Djiido",
    "country": "NC",
    "subdivision": null,
    "languages": [
      "fr"
    ],
    "categories": [],
    "tags": [
      "chroniques",
      "info",
      "musique"
    ],
    "homepage": "http://radiodjiido.nc/",
    "favicon": null,
    "type": null,
    "sourceCount": 1,
    "updatedAt": "2026-01-14T23:39:08Z"
  },
  {
    "id": "awb_b6b12dea6411bf77a0c5",
    "name": "Radio Paraiso",
    "country": "NC",
    "subdivision": null,
    "languages": [],
    "categories": [],
    "tags": [],
    "homepage": "http://www.radioparadise.com/",
    "favicon": "http://www.radioparadise.com/apple-touch-icon.png",
    "type": null,
    "sourceCount": 1,
    "updatedAt": "2026-01-14T22:54:04Z"
  },
  {
    "id": "awb_a6ad9cb161a71e7d9279",
    "name": "Radio Rythme Bleu",
    "country": "NC",
    "subdivision": null,
    "languages": [],
    "categories": [],
    "tags": [],
    "homepage": "https://www.rrb.nc/",
    "favicon": "https://www.rrb.nc/favicon.ico",
    "type": null,
    "sourceCount": 1,
    "updatedAt": "2026-01-14T22:54:12Z"
  }
]
