[
  {
    "id": "awb_016f07ddae0ad3a4c015",
    "name": "EDM Radio",
    "country": "SH",
    "subdivision": null,
    "languages": [],
    "categories": [],
    "tags": [],
    "homepage": "https://laut.fm/",
    "favicon": null,
    "type": null,
    "sourceCount": 1,
    "updatedAt": "2026-01-14T22:54:11Z"
  },
  {
    "id": "awb_e991ac04eda43fcf4054",
    "name": "Radio Jamestown 107.7",
    "country": "SH",
    "subdivision": "Saint Helena",
    "languages": [],
    "categories": [],
    "tags": [],
    "homepage": "https://radio.garden/visit/jamestown/9nlHZbxb?hl=pt-BR",
    "favicon": null,
    "type": null,
    "sourceCount": 1,
    "updatedAt": "2026-08-30T14:23:32Z"
  },
  {
    "id": "awb_2c5861f8ca6badc5e197",
    "name": "Saint.FM",
    "country": "SH",
    "subdivision": null,
    "languages": [],
    "categories": [
      "community"
    ],
    "tags": [
      "community radio"
    ],
    "homepage": "http://www.saint.fm/",
    "favicon": null,
    "type": "community",
    "sourceCount": 1,
    "updatedAt": "2026-01-14T22:54:12Z"
  }
]
