[
  {
    "id": "awb_c53b9e7c9ead9ebeb5b7",
    "name": "Abdulbasit Abdulsamad",
    "country": "KH",
    "subdivision": null,
    "languages": [
      "ar"
    ],
    "categories": [],
    "tags": [],
    "homepage": "https://mp3islam.com/",
    "favicon": null,
    "type": null,
    "sourceCount": 1,
    "updatedAt": "2026-08-23"
  },
  {
    "id": "awb_95f5c1cdfd98cfb5fbb1",
    "name": "Family FM 99.5 (Witthyu Krousar)",
    "country": "KH",
    "subdivision": null,
    "languages": [
      "km"
    ],
    "categories": [],
    "tags": [
      "family",
      "khmer",
      "music",
      "phnom penh"
    ],
    "homepage": "https://www.facebook.com/Familyfm99.5/",
    "favicon": null,
    "type": null,
    "sourceCount": 2,
    "updatedAt": "2026-08-23"
  },
  {
    "id": "awb_ab4ac1b0511d762c9003",
    "name": "Hang Meas FM 104.5",
    "country": "KH",
    "subdivision": null,
    "languages": [
      "km"
    ],
    "categories": [
      "pop"
    ],
    "tags": [
      "entertainment",
      "khmer",
      "phnom penh",
      "pop"
    ],
    "homepage": "http://www.hangmeashd.com/",
    "favicon": null,
    "type": null,
    "sourceCount": 1,
    "updatedAt": "2026-05-20T03:55:07Z"
  },
  {
    "id": "awb_ddf3b837b8994ae3672b",
    "name": "LDP Radio",
    "country": "KH",
    "subdivision": null,
    "languages": [
      "km"
    ],
    "categories": [
      "talk"
    ],
    "tags": [
      "khmer",
      "phnom penh",
      "politics",
      "talk"
    ],
    "homepage": null,
    "favicon": null,
    "type": null,
    "sourceCount": 2,
    "updatedAt": "2026-08-23"
  },
  {
    "id": "awb_e97cc147da5e6b91c4be",
    "name": "National Radio of Kampuchea",
    "country": "KH",
    "subdivision": null,
    "languages": [
      "km"
    ],
    "categories": [],
    "tags": [],
    "homepage": "http://rnk.gov.kh/",
    "favicon": "https://storage.googleapis.com/rnk/notification-icon-150x150.png",
    "type": null,
    "sourceCount": 1,
    "updatedAt": "2026-01-15T05:14:22Z"
  },
  {
    "id": "awb_a1a6cda7d6c51c8de415",
    "name": "Phnom Penh Radio FM 103",
    "country": "KH",
    "subdivision": null,
    "languages": [
      "km"
    ],
    "categories": [
      "news",
      "talk"
    ],
    "tags": [
      "khmer",
      "news",
      "phnom penh",
      "talk",
      "variety"
    ],
    "homepage": null,
    "favicon": null,
    "type": null,
    "sourceCount": 1,
    "updatedAt": "2026-05-20T03:55:20Z"
  },
  {
    "id": "awb_5c3d0d11054c480253df",
    "name": "Pop Radio 21",
    "country": "KH",
    "subdivision": null,
    "languages": [
      "km"
    ],
    "categories": [
      "folk",
      "pop"
    ],
    "tags": [
      "asian",
      "folk",
      "khmer",
      "phnom penh",
      "pop"
    ],
    "homepage": null,
    "favicon": null,
    "type": null,
    "sourceCount": 2,
    "updatedAt": "2026-08-23"
  },
  {
    "id": "awb_6634a7591fff04e8d6d9",
    "name": "RNK FM 96 (Radio National Kampuchea)",
    "country": "KH",
    "subdivision": null,
    "languages": [
      "km"
    ],
    "categories": [
      "news"
    ],
    "tags": [
      "khmer",
      "national",
      "news",
      "phnom penh",
      "public"
    ],
    "homepage": null,
    "favicon": null,
    "type": null,
    "sourceCount": 1,
    "updatedAt": "2026-05-20T13:56:43Z"
  },
  {
    "id": "awb_0ae7b67dd54fb51c88b0",
    "name": "Sangkem Radio",
    "country": "KH",
    "subdivision": "Siem Reap",
    "languages": [],
    "categories": [],
    "tags": [],
    "homepage": "https://www.sangkemtv.com/sangkem-online-radio",
    "favicon": null,
    "type": null,
    "sourceCount": 2,
    "updatedAt": "2026-08-23"
  },
  {
    "id": "awb_350553fed38a34e1497a",
    "name": "Sweet FM 88 (Siem Reap)",
    "country": "KH",
    "subdivision": null,
    "languages": [
      "km"
    ],
    "categories": [
      "pop"
    ],
    "tags": [
      "khmer",
      "music",
      "pop",
      "siem reap"
    ],
    "homepage": null,
    "favicon": null,
    "type": null,
    "sourceCount": 2,
    "updatedAt": "2026-08-23"
  }
]
