[
  {
    "id": "awb_58e74a2ddccee33d8056",
    "name": "103 The Beat",
    "country": "BS",
    "subdivision": "New Providence, Nassau",
    "languages": [
      "en"
    ],
    "categories": [
      "pop"
    ],
    "tags": [
      "pop"
    ],
    "homepage": "https://103beat.com/",
    "favicon": "https://103beat.com/wp-content/uploads/2019/05/103thebeat-700x700.jpeg",
    "type": null,
    "sourceCount": 1,
    "updatedAt": "2026-01-14T23:34:44Z"
  },
  {
    "id": "awb_ccd7934f25b7b26acf5c",
    "name": "96.9 FM GuardianRadio",
    "country": "BS",
    "subdivision": "Nassau",
    "languages": [],
    "categories": [],
    "tags": [],
    "homepage": "https://guardiantalkradio.com/",
    "favicon": "https://guardiantalkradio.com/wp-content/themes/guardianradio/images/logo_site1.png",
    "type": null,
    "sourceCount": 2,
    "updatedAt": "2026-08-23"
  },
  {
    "id": "awb_c4855f7f9931a59a13fe",
    "name": "96.9FM GuardianRadio",
    "country": "BS",
    "subdivision": null,
    "languages": [],
    "categories": [],
    "tags": [],
    "homepage": "https://guardiantalkradio.com/",
    "favicon": "https://guardiantalkradio.com/wp-content/themes/guardianradio/images/logo_site1.png",
    "type": null,
    "sourceCount": 1,
    "updatedAt": "2026-01-14T22:54:07Z"
  },
  {
    "id": "awb_b073df3c7fde9747f5c0",
    "name": "Abdulbasit Abdulsamad",
    "country": "BS",
    "subdivision": null,
    "languages": [
      "ar"
    ],
    "categories": [],
    "tags": [],
    "homepage": "https://mp3islam.com/",
    "favicon": null,
    "type": null,
    "sourceCount": 2,
    "updatedAt": "2026-08-23"
  },
  {
    "id": "awb_4f2cf322f11c4ded9626",
    "name": "Bahamian or Nuttin",
    "country": "BS",
    "subdivision": null,
    "languages": [
      "en"
    ],
    "categories": [],
    "tags": [
      "caribbean",
      "junkanoo"
    ],
    "homepage": "https://www.bahamianornuttin.com/",
    "favicon": "https://img1.wsimg.com/isteam/ip/3828e59f-f1ce-4e2a-8946-b8dbdfaadc31/favicon/78d0b8fe-c6cf-4ef3-a4dc-f5284754eed2.png/:/rs=w:64,h:64,m",
    "type": null,
    "sourceCount": 2,
    "updatedAt": "2026-08-23"
  },
  {
    "id": "awb_9574ed8b7203f946f9b3",
    "name": "Bahamianor Nuttin 92.5 FM",
    "country": "BS",
    "subdivision": null,
    "languages": [
      "en"
    ],
    "categories": [],
    "tags": [
      "caribbean",
      "junkanoo"
    ],
    "homepage": "https://www.bahamianornuttin.com/",
    "favicon": "https://img1.wsimg.com/isteam/ip/3828e59f-f1ce-4e2a-8946-b8dbdfaadc31/favicon/78d0b8fe-c6cf-4ef3-a4dc-f5284754eed2.png/:/rs=w:64,h:64,m",
    "type": null,
    "sourceCount": 1,
    "updatedAt": "2026-01-15T05:48:32Z"
  },
  {
    "id": "awb_d392b4f29da217589b00",
    "name": "Global 99.5 FM",
    "country": "BS",
    "subdivision": null,
    "languages": [
      "en"
    ],
    "categories": [],
    "tags": [],
    "homepage": "http://globalradio995fm.com/",
    "favicon": "https://cdn-radiotime-logos.tunein.com/s206590q.png",
    "type": null,
    "sourceCount": 1,
    "updatedAt": "2026-01-15T01:20:44Z"
  },
  {
    "id": "awb_7055f970c74a6f49f1ab",
    "name": "Kingdom Living Publications & Media Ltd",
    "country": "BS",
    "subdivision": "Grand Bahama",
    "languages": [],
    "categories": [],
    "tags": [],
    "homepage": "https://www.klpmradio.com/",
    "favicon": "https://www.klpmradio.com/",
    "type": null,
    "sourceCount": 2,
    "updatedAt": "2026-08-23"
  },
  {
    "id": "awb_a2d9ce1a007612e3ae0f",
    "name": "LCLHST R1",
    "country": "BS",
    "subdivision": null,
    "languages": [
      "en"
    ],
    "categories": [
      "electronic"
    ],
    "tags": [
      "electro sets",
      "electronic",
      "minimal",
      "techno"
    ],
    "homepage": "http://radio.lclhst.net/",
    "favicon": null,
    "type": null,
    "sourceCount": 1,
    "updatedAt": "2026-01-15T00:22:18Z"
  },
  {
    "id": "awb_f826847b974d8bf83a54",
    "name": "LCLHST R2",
    "country": "BS",
    "subdivision": null,
    "languages": [
      "en"
    ],
    "categories": [
      "electronic"
    ],
    "tags": [
      "electro sets",
      "electronic",
      "minimal",
      "techno"
    ],
    "homepage": "http://radio.lclhst.net/",
    "favicon": null,
    "type": null,
    "sourceCount": 1,
    "updatedAt": "2026-01-15T04:15:53Z"
  },
  {
    "id": "awb_1c2a12327a10c857fb93",
    "name": "Minimal, Techno, Electro Sets @ http://radio.lclhst.net/",
    "country": "BS",
    "subdivision": null,
    "languages": [],
    "categories": [],
    "tags": [],
    "homepage": "http://radio.lclhst.net/",
    "favicon": null,
    "type": null,
    "sourceCount": 1,
    "updatedAt": "2026-03-27T14:11:06Z"
  }
]
