[
  {
    "id": "awb_b136ba5a3692c7748c10",
    "name": "Lao National Radio 103.7",
    "country": "LA",
    "subdivision": null,
    "languages": [],
    "categories": [],
    "tags": [],
    "homepage": "https://lnr.org.la/",
    "favicon": "https://lnr.org.la/wp-content/uploads/2021/02/Radio-Logo-lnr01-300x300.png",
    "type": null,
    "sourceCount": 1,
    "updatedAt": "2026-01-14T22:54:11Z"
  },
  {
    "id": "awb_3455547cd2bf24a1adee",
    "name": "Lao National Radio 94.3",
    "country": "LA",
    "subdivision": null,
    "languages": [],
    "categories": [],
    "tags": [],
    "homepage": "https://lnr.org.la/",
    "favicon": "https://lnr.org.la/wp-content/uploads/2021/02/Radio-Logo-lnr01-300x300.png",
    "type": null,
    "sourceCount": 1,
    "updatedAt": "2026-01-14T22:54:11Z"
  },
  {
    "id": "awb_0488bb0b1f9d90c2de14",
    "name": "Toki Pona Radio",
    "country": "LA",
    "subdivision": null,
    "languages": [],
    "categories": [],
    "tags": [],
    "homepage": "https://kute.pona.la/",
    "favicon": null,
    "type": null,
    "sourceCount": 1,
    "updatedAt": "2026-03-09T20:38:46Z"
  },
  {
    "id": "awb_afd2bb08ff60f43b7edb",
    "name": "东盟电视台",
    "country": "LA",
    "subdivision": null,
    "languages": [
      "zh"
    ],
    "categories": [],
    "tags": [
      "tv"
    ],
    "homepage": "https://tvasean.com/",
    "favicon": "https://img1.wsimg.com/isteam/ip/b4b5610f-9197-46fd-b84b-9960a86df716/%E5%9B%BE%E7%89%87%201.gif/:/rs=w:406,h:380,cg:true,m/cr=w:406,h:380/qt=q:100/ll",
    "type": null,
    "sourceCount": 1,
    "updatedAt": "2026-10-25T12:55:56Z"
  }
]
