[
  {
    "id": "awb_ac7350502fa566457bbf",
    "name": "Abdulbasit Abdulsamad",
    "country": "GM",
    "subdivision": null,
    "languages": [
      "ar"
    ],
    "categories": [],
    "tags": [],
    "homepage": "https://mp3islam.com/",
    "favicon": null,
    "type": null,
    "sourceCount": 1,
    "updatedAt": "2026-01-15T05:17:36Z"
  }
]
