[
  {
    "id": "awb_49dbca638a727a7d9422",
    "name": "Abdulbasit Abdulsamad",
    "country": "PF",
    "subdivision": null,
    "languages": [
      "ar"
    ],
    "categories": [],
    "tags": [],
    "homepage": "https://mp3islam.com/",
    "favicon": null,
    "type": null,
    "sourceCount": 1,
    "updatedAt": "2026-08-23"
  },
  {
    "id": "awb_2228c8052431e49cbb2b",
    "name": "HITI FM",
    "country": "PF",
    "subdivision": null,
    "languages": [
      "fr",
      "ty"
    ],
    "categories": [],
    "tags": [],
    "homepage": "http://hitifm.fr/",
    "favicon": null,
    "type": null,
    "sourceCount": 1,
    "updatedAt": "2026-01-15T07:08:10Z"
  },
  {
    "id": "awb_f5519376cdda88334356",
    "name": "Hiti FM",
    "country": "PF",
    "subdivision": null,
    "languages": [
      "en",
      "fr"
    ],
    "categories": [
      "pop"
    ],
    "tags": [
      "pop music",
      "pop-music"
    ],
    "homepage": "https://hiti-fm.com/",
    "favicon": null,
    "type": null,
    "sourceCount": 2,
    "updatedAt": "2026-08-23"
  },
  {
    "id": "awb_1d7937d18b1a22988cd1",
    "name": "Nostalgie 100% Francais 80",
    "country": "PF",
    "subdivision": null,
    "languages": [
      "fr"
    ],
    "categories": [
      "oldies",
      "pop"
    ],
    "tags": [
      "80's",
      "80s",
      "french radio",
      "pop"
    ],
    "homepage": "https://www.nostalgie.fr/webradios/mur-des-radios/nostalgie-100-francais-80",
    "favicon": null,
    "type": null,
    "sourceCount": 2,
    "updatedAt": "2026-08-23"
  },
  {
    "id": "awb_374dfd4ff643fd8e00a4",
    "name": "Polynésie 1ère",
    "country": "PF",
    "subdivision": null,
    "languages": [
      "fr"
    ],
    "categories": [
      "news",
      "pop"
    ],
    "tags": [
      "information",
      "local music",
      "local news",
      "pop"
    ],
    "homepage": "https://la1ere.francetvinfo.fr/polynesie/",
    "favicon": "https://la1ere.francetvinfo.fr/favicon.ico",
    "type": null,
    "sourceCount": 3,
    "updatedAt": "2026-08-23"
  },
  {
    "id": "awb_b7d9d78e6a384bb3d69c",
    "name": "Polynesie Première",
    "country": "PF",
    "subdivision": null,
    "languages": [
      "fr"
    ],
    "categories": [],
    "tags": [],
    "homepage": "https://la1ere.francetvinfo.fr/polynesie/",
    "favicon": "https://upload.wikimedia.org/wikipedia/commons/thumb/b/b1/Polyn%C3%A9sie_La_1%C3%A8re_-_Logo_2018.svg/langfr-200px-Polyn%C3%A9sie_La_1%C3%A8re_-_Logo_2018.svg.png",
    "type": null,
    "sourceCount": 1,
    "updatedAt": "2026-01-15T05:29:20Z"
  },
  {
    "id": "awb_68431686305f1bdd4b15",
    "name": "Radio 1 PF",
    "country": "PF",
    "subdivision": null,
    "languages": [
      "fr"
    ],
    "categories": [],
    "tags": [],
    "homepage": "https://www.radio1.pf/",
    "favicon": null,
    "type": null,
    "sourceCount": 2,
    "updatedAt": "2026-08-23"
  },
  {
    "id": "awb_24986ca135f35d59cbef",
    "name": "Radio 1 Tahiti",
    "country": "PF",
    "subdivision": null,
    "languages": [
      "fr"
    ],
    "categories": [
      "pop"
    ],
    "tags": [
      "local information",
      "local music",
      "pop music"
    ],
    "homepage": "https://www.radio1.pf/",
    "favicon": null,
    "type": null,
    "sourceCount": 1,
    "updatedAt": "2026-01-15T00:53:11Z"
  },
  {
    "id": "awb_40399169756d1ba8f164",
    "name": "Radio Melod'iles",
    "country": "PF",
    "subdivision": null,
    "languages": [
      "fr",
      "ty"
    ],
    "categories": [],
    "tags": [
      "local",
      "tahitian"
    ],
    "homepage": "https://radiomelodiles.radiostream321.com/",
    "favicon": null,
    "type": null,
    "sourceCount": 1,
    "updatedAt": "2026-08-04T20:50:47Z"
  },
  {
    "id": "awb_fc8e8c99cb47183918bd",
    "name": "Radio1 Tahiti",
    "country": "PF",
    "subdivision": null,
    "languages": [],
    "categories": [],
    "tags": [],
    "homepage": "https://www.radio1.pf/",
    "favicon": null,
    "type": null,
    "sourceCount": 1,
    "updatedAt": "2026-01-14T22:54:04Z"
  },
  {
    "id": "awb_7df80402e695d83ab937",
    "name": "Tiare FM",
    "country": "PF",
    "subdivision": null,
    "languages": [
      "fr"
    ],
    "categories": [
      "pop"
    ],
    "tags": [
      "local information",
      "local music",
      "pop music",
      "pop-music"
    ],
    "homepage": "https://www.tiarefm.pf/",
    "favicon": "https://www.tiarefm.pf/favicon.ico",
    "type": null,
    "sourceCount": 3,
    "updatedAt": "2026-08-23"
  }
]
