[
  {
    "id": "awb_93ab026757dff54aefe1",
    "name": "Abdulbasit Abdulsamad",
    "country": "MR",
    "subdivision": null,
    "languages": [
      "ar"
    ],
    "categories": [],
    "tags": [],
    "homepage": "https://mp3islam.com/",
    "favicon": null,
    "type": null,
    "sourceCount": 1,
    "updatedAt": "2026-01-15T07:22:38Z"
  }
]
