[
  {
    "id": "awb_21b4f5cc4d8e3d895c2c",
    "name": ".. مختصر التفسير",
    "country": "BH",
    "subdivision": null,
    "languages": [],
    "categories": [
      "classical"
    ],
    "tags": [
      "classical"
    ],
    "homepage": null,
    "favicon": null,
    "type": null,
    "sourceCount": 2,
    "updatedAt": "2026-01-14T22:54:44Z"
  },
  {
    "id": "awb_206d1be59da77e899d4a",
    "name": ".beautiful recitation",
    "country": "BH",
    "subdivision": null,
    "languages": [],
    "categories": [
      "classical"
    ],
    "tags": [
      "classical"
    ],
    "homepage": null,
    "favicon": null,
    "type": null,
    "sourceCount": 2,
    "updatedAt": "2026-08-23"
  },
  {
    "id": "awb_2898cc19747eb74c44eb",
    "name": ".Quran",
    "country": "BH",
    "subdivision": null,
    "languages": [],
    "categories": [
      "classical"
    ],
    "tags": [
      "classical"
    ],
    "homepage": null,
    "favicon": null,
    "type": null,
    "sourceCount": 1,
    "updatedAt": "2026-01-14T22:54:04Z"
  },
  {
    "id": "awb_d8d08793d30ff46dd7f8",
    "name": ".إذاعة ماهر المعيقلي",
    "country": "BH",
    "subdivision": null,
    "languages": [],
    "categories": [
      "classical"
    ],
    "tags": [
      "classical"
    ],
    "homepage": null,
    "favicon": null,
    "type": null,
    "sourceCount": 1,
    "updatedAt": "2026-01-14T22:54:04Z"
  },
  {
    "id": "awb_1961041e862e442c3c8e",
    "name": ".القارئ محمد أيوب",
    "country": "BH",
    "subdivision": null,
    "languages": [],
    "categories": [
      "classical"
    ],
    "tags": [
      "classical"
    ],
    "homepage": null,
    "favicon": null,
    "type": null,
    "sourceCount": 1,
    "updatedAt": "2026-01-14T22:54:44Z"
  },
  {
    "id": "awb_1ac1996b8731fa705509",
    "name": ".القرآن",
    "country": "BH",
    "subdivision": null,
    "languages": [],
    "categories": [
      "classical"
    ],
    "tags": [
      "classical"
    ],
    "homepage": null,
    "favicon": null,
    "type": null,
    "sourceCount": 2,
    "updatedAt": "2026-08-23"
  },
  {
    "id": "awb_c04872056b71c49734a2",
    "name": "Abdulbasit Abdulsamad",
    "country": "BH",
    "subdivision": null,
    "languages": [
      "ar"
    ],
    "categories": [],
    "tags": [],
    "homepage": "https://mp3islam.com/",
    "favicon": null,
    "type": null,
    "sourceCount": 2,
    "updatedAt": "2026-08-23"
  },
  {
    "id": "awb_a50853a5eba0bdb69298",
    "name": "AFN 360 Bahrain",
    "country": "BH",
    "subdivision": null,
    "languages": [
      "en"
    ],
    "categories": [],
    "tags": [
      "american forces network"
    ],
    "homepage": "http://www.afneurope.net/AFN-360/",
    "favicon": null,
    "type": null,
    "sourceCount": 1,
    "updatedAt": "2026-01-15T06:35:42Z"
  },
  {
    "id": "awb_7b2c39226272f5e23980",
    "name": "AFN GO BAHRAIN",
    "country": "BH",
    "subdivision": null,
    "languages": [],
    "categories": [],
    "tags": [],
    "homepage": "https://afngo.net/afneurope/Aviano/radio/Bahrain",
    "favicon": "https://afngo.net/static/media/Bahrain.24eaa086d110f57b7e38.png",
    "type": null,
    "sourceCount": 2,
    "updatedAt": "2026-08-23"
  },
  {
    "id": "awb_2faf19a518a66c52304b",
    "name": "Bahrain 106.1 FM",
    "country": "BH",
    "subdivision": null,
    "languages": [
      "ar"
    ],
    "categories": [
      "religious"
    ],
    "tags": [
      "bahrain",
      "islam",
      "quran"
    ],
    "homepage": "https://www.mia.gov.bh/media-center/quran-kareem-106-1",
    "favicon": "https://www.mia.gov.bh/wp-content/uploads/2023/02/cropped-Royal-Emblem-192x192.png",
    "type": null,
    "sourceCount": 1,
    "updatedAt": "2026-04-30T17:21:02Z"
  },
  {
    "id": "awb_549a67fe8f5767a3dee6",
    "name": "Bahrain FM 93.3",
    "country": "BH",
    "subdivision": null,
    "languages": [],
    "categories": [],
    "tags": [
      "bahrain",
      "bahrain fm 93.3"
    ],
    "homepage": "https://www.mia.gov.bh/media-center/bahrain-fm-93-3/?lang=en",
    "favicon": null,
    "type": null,
    "sourceCount": 1,
    "updatedAt": "2026-01-14T22:54:10Z"
  },
  {
    "id": "awb_794633a2f303ec1f1cc6",
    "name": "Bahrain Quran 106.1 FM",
    "country": "BH",
    "subdivision": null,
    "languages": [],
    "categories": [
      "religious"
    ],
    "tags": [
      "bahrain",
      "quran"
    ],
    "homepage": "https://www.mia.gov.bh/media-center/quran-kareem-106-1/?lang=en",
    "favicon": null,
    "type": null,
    "sourceCount": 1,
    "updatedAt": "2026-04-30T09:15:56Z"
  },
  {
    "id": "awb_8a3e7ed5dbeb62f7455a",
    "name": "ccc",
    "country": "BH",
    "subdivision": null,
    "languages": [],
    "categories": [],
    "tags": [],
    "homepage": "https://m-aac.cbs.co.kr/mweb_cbs939/_definst_/cbs939.stream/playlist.m3u8",
    "favicon": null,
    "type": null,
    "sourceCount": 1,
    "updatedAt": "2026-01-14T22:54:10Z"
  },
  {
    "id": "awb_b065d36804b9c05ecb56",
    "name": "Live FM",
    "country": "BH",
    "subdivision": null,
    "languages": [
      "en",
      "hi",
      "kn",
      "ml",
      "ta",
      "te",
      "ur"
    ],
    "categories": [],
    "tags": [],
    "homepage": "https://www.livefm.bh/",
    "favicon": null,
    "type": null,
    "sourceCount": 2,
    "updatedAt": "2026-01-15T04:26:23Z"
  },
  {
    "id": "awb_4234f9f8cb4aee27f783",
    "name": "Monte Carlo Doualiya",
    "country": "BH",
    "subdivision": null,
    "languages": [],
    "categories": [],
    "tags": [],
    "homepage": "https://www.mc-doualiya.com/",
    "favicon": null,
    "type": null,
    "sourceCount": 2,
    "updatedAt": "2026-08-23"
  },
  {
    "id": "awb_8f68692463ed18fd7ca6",
    "name": "Panorama FM",
    "country": "BH",
    "subdivision": null,
    "languages": [],
    "categories": [],
    "tags": [],
    "homepage": "https://www.mbc.net/channels",
    "favicon": "https://www.mbc.net/apple-touch-icon.png",
    "type": null,
    "sourceCount": 1,
    "updatedAt": "2026-01-14T22:54:07Z"
  },
  {
    "id": "awb_8feaf12f79608dd9d3a2",
    "name": "Traditional Radio 95.0",
    "country": "BH",
    "subdivision": null,
    "languages": [],
    "categories": [],
    "tags": [
      "bahrain",
      "traditional radio 95.0"
    ],
    "homepage": "https://www.mia.gov.bh/media-center/traditional-radio-95-0/?lang=en",
    "favicon": null,
    "type": null,
    "sourceCount": 1,
    "updatedAt": "2026-01-14T22:54:09Z"
  },
  {
    "id": "awb_0a04a2178e64923ef29e",
    "name": "Voice of Ummah",
    "country": "BH",
    "subdivision": null,
    "languages": [],
    "categories": [],
    "tags": [],
    "homepage": "https://www.voiceofummah.org/",
    "favicon": null,
    "type": null,
    "sourceCount": 1,
    "updatedAt": "2026-01-14T22:54:12Z"
  },
  {
    "id": "awb_7efec32d8e0c82e8f847",
    "name": "إذاعة القرآن الكريم",
    "country": "BH",
    "subdivision": null,
    "languages": [],
    "categories": [
      "classical"
    ],
    "tags": [
      "classical"
    ],
    "homepage": null,
    "favicon": "https://i.pinimg.com/564x/3a/a1/a1/3aa1a107c9434ca52b42b2dd0ffc896f.jpg",
    "type": null,
    "sourceCount": 2,
    "updatedAt": "2026-08-23"
  },
  {
    "id": "awb_8cd3b8455bc61b378b24",
    "name": "اذاعة القرآن الكريم",
    "country": "BH",
    "subdivision": null,
    "languages": [],
    "categories": [
      "classical"
    ],
    "tags": [
      "classical"
    ],
    "homepage": null,
    "favicon": null,
    "type": null,
    "sourceCount": 1,
    "updatedAt": "2026-01-14T22:54:03Z"
  },
  {
    "id": "awb_4ec183d388ead5967497",
    "name": "تفسير بن عثيمين رحمه الله",
    "country": "BH",
    "subdivision": null,
    "languages": [],
    "categories": [
      "classical"
    ],
    "tags": [
      "classical"
    ],
    "homepage": null,
    "favicon": null,
    "type": null,
    "sourceCount": 2,
    "updatedAt": "2026-08-23"
  }
]
