[
  {
    "id": "awb_9c2f15d63ff93ddca141",
    "name": "104.3 Boss FM",
    "country": "GU",
    "subdivision": null,
    "languages": [],
    "categories": [],
    "tags": [],
    "homepage": "https://boss104.gu/",
    "favicon": null,
    "type": null,
    "sourceCount": 2,
    "updatedAt": "2026-08-23"
  },
  {
    "id": "awb_7b608b0dcdea674d77b4",
    "name": "Abdulbasit Abdulsamad",
    "country": "GU",
    "subdivision": null,
    "languages": [
      "ar"
    ],
    "categories": [],
    "tags": [],
    "homepage": "https://mp3islam.com/",
    "favicon": null,
    "type": null,
    "sourceCount": 2,
    "updatedAt": "2026-08-23"
  },
  {
    "id": "awb_dd7788b462b609538b41",
    "name": "Harvest Family Radio Guam",
    "country": "GU",
    "subdivision": null,
    "languages": [],
    "categories": [],
    "tags": [],
    "homepage": "https://khmg.org/",
    "favicon": "https://khmg.org/wp-content/uploads/logo_330.png",
    "type": null,
    "sourceCount": 2,
    "updatedAt": "2026-08-23"
  },
  {
    "id": "awb_d82365e81ce82a1246d5",
    "name": "KIJI 104.3 FM Hagatna, Guam",
    "country": "GU",
    "subdivision": "Hagatna",
    "languages": [
      "en"
    ],
    "categories": [
      "pop"
    ],
    "tags": [
      "classic hits"
    ],
    "homepage": "https://boss104.gu/",
    "favicon": "https://kiji-fm.linkedupradio.com/assets/images/logo/logo.png",
    "type": null,
    "sourceCount": 1,
    "updatedAt": "2026-10-12T11:09:53Z"
  },
  {
    "id": "awb_9a88d28b15b6106ce849",
    "name": "KUSG",
    "country": "GU",
    "subdivision": null,
    "languages": [
      "en"
    ],
    "categories": [
      "news",
      "talk"
    ],
    "tags": [
      "news",
      "talk"
    ],
    "homepage": "http://thepoint.gu/",
    "favicon": null,
    "type": null,
    "sourceCount": 2,
    "updatedAt": "2026-08-23"
  },
  {
    "id": "awb_7e51013fc18632297cda",
    "name": "TFC Guam",
    "country": "GU",
    "subdivision": null,
    "languages": [],
    "categories": [],
    "tags": [
      "filipino"
    ],
    "homepage": "https://mytfc.com/",
    "favicon": null,
    "type": null,
    "sourceCount": 1,
    "updatedAt": "2026-01-14T22:54:09Z"
  }
]
