[
  {
    "id": "awb_3b3fb44497bff5f7aac0",
    "name": "Abdulbasit Abdulsamad",
    "country": "AM",
    "subdivision": null,
    "languages": [
      "ar"
    ],
    "categories": [],
    "tags": [],
    "homepage": "https://mp3islam.com/",
    "favicon": null,
    "type": null,
    "sourceCount": 2,
    "updatedAt": "2026-08-23"
  },
  {
    "id": "awb_27286ed2ae761b87a5ab",
    "name": "Armenian Bible Study Radio",
    "country": "AM",
    "subdivision": null,
    "languages": [],
    "categories": [],
    "tags": [],
    "homepage": "https://armenianbiblestudy.com/",
    "favicon": "https://armenianbiblestudy.com/wp-content/uploads/2021/07/ABS-Logo.png",
    "type": null,
    "sourceCount": 2,
    "updatedAt": "2026-08-23"
  },
  {
    "id": "awb_c82795d54c31af639c0f",
    "name": "Armenian Christian Radio - Bashde Radio",
    "country": "AM",
    "subdivision": null,
    "languages": [],
    "categories": [],
    "tags": [],
    "homepage": "http://bashde.org/",
    "favicon": "http://bashde.org/favicon.ico",
    "type": null,
    "sourceCount": 2,
    "updatedAt": "2026-08-23"
  },
  {
    "id": "awb_08a84e7502607c0b2990",
    "name": "Armenian Radio",
    "country": "AM",
    "subdivision": "Yerevan",
    "languages": [
      "en",
      "hy",
      "ru"
    ],
    "categories": [],
    "tags": [
      "entertainment",
      "pop music",
      "pop-music"
    ],
    "homepage": "https://www.laarmenianradio.com/",
    "favicon": null,
    "type": null,
    "sourceCount": 2,
    "updatedAt": "2026-08-23"
  },
  {
    "id": "awb_d54c8dcaf7082c8ed44b",
    "name": "Fama",
    "country": "AM",
    "subdivision": null,
    "languages": [],
    "categories": [],
    "tags": [],
    "homepage": "https://www.radiofama.am/",
    "favicon": null,
    "type": null,
    "sourceCount": 1,
    "updatedAt": "2026-01-14T22:54:03Z"
  },
  {
    "id": "awb_8132ef44b24c57cf5d82",
    "name": "Jazz FM 106.9 Yerevan Radio",
    "country": "AM",
    "subdivision": null,
    "languages": [
      "hy"
    ],
    "categories": [
      "jazz"
    ],
    "tags": [
      "jazz"
    ],
    "homepage": "https://www.radiojazzfm.am/",
    "favicon": "https://www.radiojazzfm.am/img/core-img/logo2.png",
    "type": null,
    "sourceCount": 1,
    "updatedAt": "2026-05-25T22:08:43Z"
  },
  {
    "id": "awb_79e6576419febe056260",
    "name": "Kiss FM Armenia",
    "country": "AM",
    "subdivision": null,
    "languages": [],
    "categories": [],
    "tags": [],
    "homepage": "https://www.kissfm.am/en/home",
    "favicon": null,
    "type": null,
    "sourceCount": 1,
    "updatedAt": "2026-01-14T22:54:07Z"
  },
  {
    "id": "awb_17d3e006c35f77e6c5ec",
    "name": "Lav Radio",
    "country": "AM",
    "subdivision": null,
    "languages": [
      "hy"
    ],
    "categories": [],
    "tags": [
      "armenian"
    ],
    "homepage": "https://www.lavradio.am/",
    "favicon": "https://www.lavradio.am/wp-content/uploads/2020/08/lav350.png",
    "type": null,
    "sourceCount": 2,
    "updatedAt": "2026-08-23"
  },
  {
    "id": "awb_796ac025153adc527a86",
    "name": "Lav Radio Mix",
    "country": "AM",
    "subdivision": null,
    "languages": [],
    "categories": [],
    "tags": [],
    "homepage": "https://lavradio.am/",
    "favicon": null,
    "type": null,
    "sourceCount": 1,
    "updatedAt": "2026-01-14T22:54:10Z"
  },
  {
    "id": "awb_b880dc8e8bbb094913c0",
    "name": "LOVE RADIO",
    "country": "AM",
    "subdivision": null,
    "languages": [],
    "categories": [],
    "tags": [
      "international"
    ],
    "homepage": null,
    "favicon": null,
    "type": null,
    "sourceCount": 2,
    "updatedAt": "2026-08-23"
  },
  {
    "id": "awb_194c9e2ccc30badae358",
    "name": "Lratvakan Radio",
    "country": "AM",
    "subdivision": null,
    "languages": [
      "hy"
    ],
    "categories": [
      "news"
    ],
    "tags": [
      "armenian",
      "debates & interviews",
      "news"
    ],
    "homepage": "https://www.lratvakan.am/",
    "favicon": "https://www.lratvakan.am/media/company/logo/corporate-logo_IAoQCpL.png",
    "type": null,
    "sourceCount": 1,
    "updatedAt": "2026-05-25T22:17:29Z"
  },
  {
    "id": "awb_5847e45e21c31a001eae",
    "name": "MFM Music Radio",
    "country": "AM",
    "subdivision": null,
    "languages": [],
    "categories": [
      "pop"
    ],
    "tags": [
      "modern",
      "music",
      "pop"
    ],
    "homepage": "https://www.mfm.am/",
    "favicon": null,
    "type": null,
    "sourceCount": 2,
    "updatedAt": "2026-08-23"
  },
  {
    "id": "awb_2ed3489ab724510ab496",
    "name": "Radio Marshall",
    "country": "AM",
    "subdivision": null,
    "languages": [],
    "categories": [],
    "tags": [],
    "homepage": "https://www.radiomarshall.am/",
    "favicon": "https://www.radiomarshall.am/images/logo.png",
    "type": null,
    "sourceCount": 2,
    "updatedAt": "2026-08-23"
  },
  {
    "id": "awb_524e12f6ab81ff732238",
    "name": "XFM Radio",
    "country": "AM",
    "subdivision": null,
    "languages": [],
    "categories": [],
    "tags": [],
    "homepage": "https://www.xfm.am/",
    "favicon": "http://www.lavradio.am/wp-content/uploads/2019/05/xfmlg.png",
    "type": null,
    "sourceCount": 2,
    "updatedAt": "2026-08-23"
  }
]
