[
  {
    "id": "awb_fddfd4c174f356b69144",
    "name": "Abdulbasit Abdulsamad",
    "country": "GQ",
    "subdivision": null,
    "languages": [
      "ar"
    ],
    "categories": [],
    "tags": [],
    "homepage": "https://mp3islam.com/",
    "favicon": null,
    "type": null,
    "sourceCount": 1,
    "updatedAt": "2026-01-15T08:25:40Z"
  },
  {
    "id": "awb_409e17585af6321eb68f",
    "name": "Exa FM",
    "country": "GQ",
    "subdivision": null,
    "languages": [
      "es"
    ],
    "categories": [
      "news",
      "pop",
      "rock"
    ],
    "tags": [
      "93.3 fm",
      "entretenimiento",
      "español",
      "estación",
      "exa",
      "exa fm",
      "fm",
      "juvenil",
      "la estación exacta",
      "la estación naranja",
      "moi merino",
      "mvs",
      "mvs noticias",
      "mvs radio",
      "música en español e inglés",
      "música pop",
      "ponte exa",
      "pop",
      "pop en español e inglés",
      "pop music",
      "pop rock",
      "radio"
    ],
    "homepage": "https://www.exafm.com/veracruz/",
    "favicon": "https://i.iheart.com/v3/re/new_assets/5f9883c7cde5eff19e6eabac",
    "type": null,
    "sourceCount": 1,
    "updatedAt": "2026-01-15T00:26:31Z"
  }
]
