[
  {
    "id": "awb_81a06d57cd68fe490b4a",
    "name": "Abdulbasit Abdulsamad",
    "country": "MM",
    "subdivision": null,
    "languages": [
      "ar"
    ],
    "categories": [],
    "tags": [],
    "homepage": "https://mp3islam.com/",
    "favicon": null,
    "type": null,
    "sourceCount": 1,
    "updatedAt": "2026-01-15T08:24:53Z"
  },
  {
    "id": "awb_ad8232b8991d7b60f758",
    "name": "Cherry FM",
    "country": "MM",
    "subdivision": "Shan",
    "languages": [
      "my"
    ],
    "categories": [
      "pop"
    ],
    "tags": [
      "music pop",
      "music variety",
      "variety"
    ],
    "homepage": "http://www.cherryfmmym.com/",
    "favicon": null,
    "type": null,
    "sourceCount": 3,
    "updatedAt": "2026-08-23"
  },
  {
    "id": "awb_11c698b688ea4214d643",
    "name": "DWG Radio Bumese",
    "country": "MM",
    "subdivision": null,
    "languages": [
      "my"
    ],
    "categories": [
      "religious"
    ],
    "tags": [
      "christian",
      "gospel"
    ],
    "homepage": "https://www.streamplus.de/",
    "favicon": "https://www.streamplus.de/img/favico.ico",
    "type": null,
    "sourceCount": 1,
    "updatedAt": "2026-01-15T06:20:33Z"
  },
  {
    "id": "awb_54150b805c60d9ebf2c0",
    "name": "MandalayFM",
    "country": "MM",
    "subdivision": null,
    "languages": [
      "my"
    ],
    "categories": [],
    "tags": [],
    "homepage": "https://raddio.net/",
    "favicon": "https://cdn.raddio.net/img/icons/apple-icon-120x120.png",
    "type": null,
    "sourceCount": 2,
    "updatedAt": "2026-08-23"
  },
  {
    "id": "awb_b98200893031b919f4bd",
    "name": "Padamyar FM",
    "country": "MM",
    "subdivision": null,
    "languages": [
      "my"
    ],
    "categories": [],
    "tags": [],
    "homepage": "http://padamyarfm.com/",
    "favicon": "https://padamyarfm.com.mm/favicon-32x32.png",
    "type": null,
    "sourceCount": 1,
    "updatedAt": "2026-05-17T08:03:35Z"
  }
]
