[
  {
    "id": "awb_27e376e2fe31bd49784b",
    "name": "Radio Kiribati 1440 kHz",
    "country": "KI",
    "subdivision": null,
    "languages": [],
    "categories": [
      "news"
    ],
    "tags": [
      "music",
      "news"
    ],
    "homepage": "https://en.wikipedia.org/wiki/Radio_Kiribati",
    "favicon": null,
    "type": null,
    "sourceCount": 1,
    "updatedAt": "2026-03-08T18:37:51Z"
  }
]
