[
  {
    "id": "awb_78c4f05dba2bca8e555b",
    "name": "Abdulbasit Abdulsamad",
    "country": "PM",
    "subdivision": null,
    "languages": [
      "ar"
    ],
    "categories": [],
    "tags": [],
    "homepage": "https://mp3islam.com/",
    "favicon": "https://mp3islam.com/favicon.ico",
    "type": null,
    "sourceCount": 1,
    "updatedAt": "2026-01-15T04:44:38Z"
  },
  {
    "id": "awb_f06caed5f666bad66a32",
    "name": "Archipel FM SPM (975) 103.3",
    "country": "PM",
    "subdivision": "France",
    "languages": [
      "fr"
    ],
    "categories": [
      "public"
    ],
    "tags": [
      "public radio"
    ],
    "homepage": "https://www.facebook.com/Radio-Archipel-FM-1033-985-173650349352754/",
    "favicon": "https://www.facebook.com/favicon.ico",
    "type": "public",
    "sourceCount": 1,
    "updatedAt": "2026-01-15T06:09:01Z"
  },
  {
    "id": "awb_061943e6eb7cc7ba4c2a",
    "name": "La 1ere Saint Pierre et Miquelon (975)",
    "country": "PM",
    "subdivision": "France",
    "languages": [],
    "categories": [
      "public"
    ],
    "tags": [
      "public radio"
    ],
    "homepage": "https://la1ere.francetvinfo.fr/saintpierremiquelon/",
    "favicon": "https://www.google.com/url?sa=i&url=http%3A%2F%2Ffr-fr.radioline.co%2Fecouter-rfo-radio-saint-pierre-et-miquelon&psig=AOvVaw1XKDAabRkc01Z7sN8DoKjk&ust=1637792164850000&source=images&cd=vfe&ved=0CAgQjRxqFwoTCKCbmrTBr_QCFQAAAAAdAAAAABAE",
    "type": "public",
    "sourceCount": 1,
    "updatedAt": "2026-01-14T22:54:03Z"
  }
]
