[
  {
    "id": "awb_222c03353c45e5c0ab99",
    "name": "Idaacadda Subaxnimo VOA",
    "country": "SO",
    "subdivision": null,
    "languages": [],
    "categories": [
      "news"
    ],
    "tags": [
      "news"
    ],
    "homepage": null,
    "favicon": null,
    "type": null,
    "sourceCount": 1,
    "updatedAt": "2026-01-14T22:54:03Z"
  },
  {
    "id": "awb_bd1e8a9122a141ae71fd",
    "name": "Radio Baidoa 89.5 FM",
    "country": "SO",
    "subdivision": "Ba",
    "languages": [],
    "categories": [],
    "tags": [],
    "homepage": "https://zeno.fm/radio/raadiyo-baydhabo/",
    "favicon": null,
    "type": null,
    "sourceCount": 1,
    "updatedAt": "2026-08-30T15:34:03Z"
  }
]
