[
  {
    "id": "awb_cb4c84109ba99da81341",
    "name": "Choice FM 93.3",
    "country": "SL",
    "subdivision": null,
    "languages": [],
    "categories": [],
    "tags": [],
    "homepage": "https://www.choicefmsl.com/",
    "favicon": "https://static.wixstatic.com/media/247284_502bcb35bb7d4262880f9ea7fa748868~mv2.jpg/v1/fill/w_180%2Ch_180%2Clg_1%2Cusm_0.66_1.00_0.01/247284_502bcb35bb7d4262880f9ea7fa748868~mv2.jpg",
    "type": null,
    "sourceCount": 1,
    "updatedAt": "2026-01-14T22:54:04Z"
  },
  {
    "id": "awb_a97142e24685bfea4bad",
    "name": "Sierra Network Radio",
    "country": "SL",
    "subdivision": null,
    "languages": [],
    "categories": [],
    "tags": [
      "african music"
    ],
    "homepage": "https://snradio.net/snradio/",
    "favicon": "https://cdn.onlineradiobox.com/img/l/0/47840.v6.png",
    "type": null,
    "sourceCount": 2,
    "updatedAt": "2026-01-14T22:54:04Z"
  }
]
