[
  {
    "id": "awb_adf7efa89124c6344697",
    "name": "Abdulbasit Abdulsamad",
    "country": "ER",
    "subdivision": null,
    "languages": [
      "ar"
    ],
    "categories": [],
    "tags": [],
    "homepage": "https://mp3islam.com/",
    "favicon": null,
    "type": null,
    "sourceCount": 1,
    "updatedAt": "2026-08-23"
  },
  {
    "id": "awb_afce12a1858ec4bc9550",
    "name": "Eri-TV",
    "country": "ER",
    "subdivision": null,
    "languages": [
      "ti"
    ],
    "categories": [
      "news"
    ],
    "tags": [
      "drama",
      "news"
    ],
    "homepage": "https://jmc-live.ercdn.net/eritreatv/eritreatv.m3u8",
    "favicon": null,
    "type": null,
    "sourceCount": 1,
    "updatedAt": "2026-04-10T00:35:03Z"
  },
  {
    "id": "awb_4a7c436871074b9666b6",
    "name": "Eritrean Music",
    "country": "ER",
    "subdivision": null,
    "languages": [
      "am"
    ],
    "categories": [],
    "tags": [
      "amharic",
      "tigrigna"
    ],
    "homepage": "https://linuxfreelancer.com/shoutcast-internet-radio",
    "favicon": "https://upload.wikimedia.org/wikipedia/commons/thumb/2/29/Flag_of_Eritrea.svg/800px-Flag_of_Eritrea.svg.png",
    "type": null,
    "sourceCount": 1,
    "updatedAt": "2026-01-15T07:58:24Z"
  },
  {
    "id": "awb_78cc5ae40e34bb7ff8a7",
    "name": "Eritrean/Ethiopian music",
    "country": "ER",
    "subdivision": null,
    "languages": [],
    "categories": [],
    "tags": [],
    "homepage": "https://linuxfreelancer.com/shoutcast-internet-radio",
    "favicon": "https://en.wikipedia.org/wiki/File:Flag_of_Eritrea.svg",
    "type": null,
    "sourceCount": 2,
    "updatedAt": "2026-08-23"
  },
  {
    "id": "awb_387ef0c6825589fe4685",
    "name": "hip hop",
    "country": "ER",
    "subdivision": null,
    "languages": [],
    "categories": [],
    "tags": [
      "music"
    ],
    "homepage": "https://yonaskassahun011.wixsite.com/selamcoffee-1",
    "favicon": "https://www.wix.com/favicon.ico",
    "type": null,
    "sourceCount": 1,
    "updatedAt": "2026-01-14T22:54:04Z"
  }
]
