[
  {
    "id": "awb_b2ec0bb7cdec123ffac1",
    "name": "Abdulbasit Abdulsamad",
    "country": "VG",
    "subdivision": null,
    "languages": [
      "ar"
    ],
    "categories": [],
    "tags": [],
    "homepage": "https://mp3islam.com/",
    "favicon": null,
    "type": null,
    "sourceCount": 1,
    "updatedAt": "2026-01-14T23:39:08Z"
  },
  {
    "id": "awb_b2b0e5d78ae28cd200f3",
    "name": "Burning Rockers",
    "country": "VG",
    "subdivision": null,
    "languages": [],
    "categories": [],
    "tags": [],
    "homepage": "http://www.burningrockers.com/",
    "favicon": "http://www.burningrockers.com/images/LOGO_TOP.jpg",
    "type": null,
    "sourceCount": 1,
    "updatedAt": "2026-02-02T15:44:04Z"
  },
  {
    "id": "awb_3126a154520f50480177",
    "name": "Soggy Dollar Radio",
    "country": "VG",
    "subdivision": "Jost",
    "languages": [],
    "categories": [],
    "tags": [],
    "homepage": "https://www.soggydollar.com/",
    "favicon": "https://www.soggydollar.com/favicon.ico",
    "type": null,
    "sourceCount": 1,
    "updatedAt": "2026-03-09T08:01:13Z"
  }
]
