[
  {
    "id": "awb_bbf1301c55fc7114ae39",
    "name": "Abdulbasit Abdulsamad",
    "country": "TC",
    "subdivision": null,
    "languages": [
      "ar"
    ],
    "categories": [],
    "tags": [],
    "homepage": "https://mp3islam.com/",
    "favicon": null,
    "type": null,
    "sourceCount": 1,
    "updatedAt": "2026-01-15T04:43:25Z"
  }
]
