[
  {
    "id": "awb_a0e312d2739d7c69a10d",
    "name": "Abdulbasit Abdulsamad",
    "country": "SM",
    "subdivision": null,
    "languages": [
      "ar"
    ],
    "categories": [],
    "tags": [],
    "homepage": "https://mp3islam.com/",
    "favicon": null,
    "type": null,
    "sourceCount": 2,
    "updatedAt": "2026-08-23"
  },
  {
    "id": "awb_18b2854c6754acd5b7b5",
    "name": "Public Radio of San Marino",
    "country": "SM",
    "subdivision": null,
    "languages": [],
    "categories": [],
    "tags": [],
    "homepage": "https://www.sanmarinortv.sm/radio",
    "favicon": null,
    "type": null,
    "sourceCount": 1,
    "updatedAt": "2026-02-28T17:11:19Z"
  },
  {
    "id": "awb_48b94dd8a2c294520c8c",
    "name": "Radio San Marino",
    "country": "SM",
    "subdivision": "Città di San Marino",
    "languages": [
      "it"
    ],
    "categories": [
      "pop"
    ],
    "tags": [
      "città di san marino",
      "pop",
      "top 40"
    ],
    "homepage": "https://www.smtvsanmarino.sm/radio/ascolta-radio-san-marino",
    "favicon": null,
    "type": null,
    "sourceCount": 1,
    "updatedAt": "2026-01-15T04:51:20Z"
  },
  {
    "id": "awb_8cb7c00789b9880bd58d",
    "name": "Radio San Marino",
    "country": "SM",
    "subdivision": null,
    "languages": [],
    "categories": [
      "pop"
    ],
    "tags": [
      "pop"
    ],
    "homepage": null,
    "favicon": null,
    "type": null,
    "sourceCount": 1,
    "updatedAt": "2026-01-14T22:54:03Z"
  },
  {
    "id": "awb_1350d96faa7159007829",
    "name": "Radio San Marino Classic",
    "country": "SM",
    "subdivision": null,
    "languages": [
      "it"
    ],
    "categories": [
      "pop"
    ],
    "tags": [
      "adult contemporary",
      "pop",
      "top 40"
    ],
    "homepage": "https://www.sanmarinortv.sm/radio",
    "favicon": "https://www.sanmarinortv.sm/assets/frontend/img/logo-310-150.png?v54",
    "type": null,
    "sourceCount": 1,
    "updatedAt": "2026-01-15T04:07:09Z"
  },
  {
    "id": "awb_f79f81e42c0e8df1807d",
    "name": "Radio San Marino Classic",
    "country": "SM",
    "subdivision": "Città di San Marino",
    "languages": [
      "it"
    ],
    "categories": [
      "pop"
    ],
    "tags": [
      "città di san marino",
      "classic hits"
    ],
    "homepage": "https://www.smtvsanmarino.sm/radio/ascolta-radio-classic",
    "favicon": null,
    "type": null,
    "sourceCount": 1,
    "updatedAt": "2026-01-15T04:47:54Z"
  },
  {
    "id": "awb_8033c75b34c628cd7cb6",
    "name": "USMARADIO",
    "country": "SM",
    "subdivision": "Città di San Marino",
    "languages": [
      "it"
    ],
    "categories": [
      "college"
    ],
    "tags": [
      "città di san marino",
      "university radio"
    ],
    "homepage": "http://www.usmaradio.org/",
    "favicon": "http://www.usmaradio.org/wp-content/uploads/2016/09/usma_logo_new_alpha_h100.png",
    "type": "college",
    "sourceCount": 1,
    "updatedAt": "2026-01-15T00:05:50Z"
  }
]
